{
  "ok": true,
  "request_id": "90000000-0000-4000-8000-000000000520",
  "lock_id": "70000000-0000-4000-8000-000000000501",
  "scope_type": "program_run",
  "program_run_id": "20000000-0000-4000-8000-000000000501",
  "sport_category": null,
  "sport_level": null,
  "protocol_version": "56d-transfer-v2-2026-07",
  "snapshot_schema_version": "program-run-evidence-lock-v2-2026-07",
  "source_cutoff": "2026-07-21T12:00:00Z",
  "locked_at": "2026-07-21T12:00:00Z",
  "checksum_algorithm": "sha256",
  "content_checksum": "aaaaaaaaaaaaaaaaaaaaaaaaaaaaaaaaaaaaaaaaaaaaaaaaaaaaaaaaaaaaaaaa",
  "analysis_manifest": {
    "manifest_version": "evidence-analysis-manifest-v2-2026-07",
    "source_cutoff": "2026-07-21T12:00:00Z",
    "scope_type": "program_run",
    "program_run_id": "20000000-0000-4000-8000-000000000501",
    "sport_category": null,
    "sport_level": null,
    "data_mode": "production_only",
    "protocol_version": "56d-transfer-v2-2026-07",
    "snapshot_schema_version": "program-run-evidence-lock-v2-2026-07",
    "checksum_algorithm": "sha256",
    "content_checksum": "aaaaaaaaaaaaaaaaaaaaaaaaaaaaaaaaaaaaaaaaaaaaaaaaaaaaaaaaaaaaaaaa",
    "minimum_aggregate_n": 5,
    "low_confidence_below_n": 10,
    "included_sections": [
      "sample",
      "usage",
      "measurement",
      "outcomes",
      "data_quality"
    ]
  },
  "evidence": {
    "generated_at": "2026-07-21T12:00:00Z",
    "schema_version": "program-run-evidence-lock-v2-2026-07",
    "scope": "program_run",
    "protocol_version": "56d-transfer-v2-2026-07",
    "meta": {},
    "sample": {},
    "usage": {},
    "team_pulse": {},
    "measurement": {},
    "outcomes": {},
    "transfer_evidence": {},
    "data_quality": {},
    "claim_boundary": {},
    "privacy": {}
  }
}
